gap_id,area,owner,clearing_action
DPA-014,Retention and deletion window,Privacy Counsel,insert approved deletion or return window in Clause 3
DPA-019,Subprocessor notice period,Vendor Management,insert approved subprocessor notice period and confirm Schedule A route
DPA-026,Security audit assistance,Security Assurance,align Clause 7 assistance language to the security addendum
DPA-033,Cross-border transfer language,Data Governance,add approved transfer assessment wording for cross-border transfers
DPA-041,Breach notice timing,Incident Response Counsel,insert approved incident notice timing in Clause 11
